year,artist,track,lyrics
1941,Glenn Miller,Chattanooga Choo Choo, Pardon me boy Is that the Chattanooga choo choo? Track twenty-nine Boy you can gimme a shine Can you afford To board a Chattanooga choo choo? I've got my fare And just a trifle to spare You leave the Pennsylvania Station 'bout a quarter to four Read a magazine and then you're in Baltimore Dinner in the diner Nothing could be finer Than to have your ham an' eggs in Carolina. When you hear the whistle blowin' eight to the bar Then you know that Tennessee is not very far Shovel all the coal in Gotta keep it rollin' Woo woo Chattanooga there you are. There's gonna be A certain party at the station Satin and lace I used to call 'funny face' She's gonna cry Until I tell her that I'll never roam So Chattanooga choo choo Won't you choo-choo me home? Chattanooga choo choo Won't you choo-choo me home?. 
1941,Sammy Kaye,Daddy,Hey listen to my story 'bout a gal named Daisy Mae Lazy Daisy Mae Her disposition is rather sweet and charming At times alarming so they say She has a man who's *talldarkhandsome* large and strong To whom she used to sing this song. Hey Daddy I want a diamond ring bracelets everything Daddy you oughta get the best for me. Hey Daddy gee don't I look swell in sables? Clothes with Paris labels? Daddy you oughta get the best for me. Here's *'n'amazing* revelation With a bit of stimulation I'd be a great sensation I'd be your inspiration. Daddy I want a brand new car champagne caviar Daddy you oughta get the best for me. Hey Daddy I want a diamond ring bracelets everything Daddy you oughta get the best for me. Hey Daddy gee don't I look swell in sables? Clothes with Paris labels? Daddy you oughta get the best for me Here's *'n'amazing* revelation With a bit of stimulation I'd be a great sensation I'd be your inspiration. Daddy I want a brand new car champagne caviar Daddy.  Daddy. You oughta get the best for me  la-dah!!. 
1941,Artie Shaw,Stardust,And now the purple dusk of twilight time. Steals across the meadows of my heart High up in the sky the little stars climb. Always reminding me that we're apart. You wander down the lane and far away. Leaving me a song that will not die. Love is now the stardust of yesterday. The music of the years gone by. Sometimes I wonder why I spend. The lonely night dreaming of a song. The melody haunts my reverie. And I am once again with you. When our love was new. And each kiss an inspiration. But that was long ago. Now my consolation. Is in the stardust of a song. Beside a garden wall When stars are bright. You are in my arms. The nightingale tells his fairy tale. A paradise where roses bloom. Though I dream in vain. In my heart it will remain. My stardust melody. The memory of love's refrain. 
1942,Glenn Miller,Moonlight Cocktail,Couple of jiggers of moonlight and add a star Pour in the blue of a June night and one guitar Mix in a couple of dreamers and there you are: Lovers hail the Moonlight cocktail... Now add a couple of flowers a drop of dew Stir for a couple of hours till dreams come true As to the number of kisses it's up to you Moonlight cocktails need a few.... Cool it in the summer breeze Serve it in the starlight underneath the trees You'll discover tricks like these Are sure to make your Moonlight cocktail please.... Follow the simple directions and they will bring Life of another complexion where you'll be king You will awake in the morning and start to sing Moonlight cocktails are the thing! 
1942,Glenn Miller,(I've Got a Gal In) Kalamazoo,A B C D E F G H I got a gal in Kalamazoo Dont want to boast but I know shes the toast of Kalamazoo (Zoo zoo zoo zoo zoo) Years have gone by my my how she grew I liked her looks when I carried her books in Kalamazoo (Zoo zoo zoo zoo zoo). Im gonna send away hoppin' on a plane leavin' today Am I dreamin? I can hear her screaminR (Zoo zoo zoo Kalamazoo) K (K) A (A) L-A-M-A-Z-O (Oh oh oh oh what a gal a real pipperoo)R(Were goin' to Michigan to see the sweetest gal in Kalamazoo) (Zoo zoo zoo zoo zoo zoo zoo zoo zoo) (Kalamazoo!!) 
1942,Frank Sinatra,There Are Such Things,A heart that's true there are such things A dream for two there are such things Someone to whisper 'Darling you're my guiding star' Not caring what you own but just what you are A peaceful sky there are such things A rainbow high where heaven sings So have a little faith and trust in what tomorrow brings You'll reach a star because there are such things. [musical interlude]. So have a little faith and trust in what tomorrow brings You'lll reach a star because there are such things 
1943,Mills Brothers,Paper Doll,I'm gonna buy a Paper Doll that I can call my own A doll that other fellows cannot steal And then the flirty flirty guys with their flirty flirty eyes Will have to flirt with dollies that are real. When I come home at night she will be waiting She'll be the truest doll in all this world I'd rather have a Paper Doll to call my own Than have a fickle-minded real live girl. I guess I had a million dolls or more I guess I've played the doll game o'er and o'er I just quarrelled with Sue that's why I'm blue She's gone away and left me just like all dolls do. I'll tell you boys it's tough to be alone And it's tough to love a doll that's not your own I'm through with all of them I'll never ball again Say boy whatcha gonna do? I'm gonna buy a Paper Doll that I can call my own A doll that other fellows cannot steal And then the flirty flirty guys with their flirty flirty eyes Will have to flirt with dollies that are real. When I come home at night she will be waiting She'll be the truest doll in all this world I'd rather have a Paper Doll to call my own Than have a fickle-minded real live girl 
1943,Bing Crosby,Oh What a Beautiful Mornin',There's a bright golden haze on the meadow There's a bright golden haze on the meadow The corn is as high as an elephant's eye An' it looks like its climbin' clear up to the sky. Chorus: Oh what a beautiful morning Oh what a beautiful day I've got a wonderful feeling Everything's going my way.. Repeat chorus. All the cattle are standing like statues All the cattel are standing like statues They don't turn their heads as they see me ride by. But a little brown mav'rick is winking her eye.. Repeat chorus. All the sounds of the earth are like music All the sounds of the earth are like music The breeze is so busy it don't miss a tree And an ol' Weepin' Willer is laughin' at me. 
1943,Rudy Vallee,As Time Goes By,This day and age we're living in Gives cause for apprehension With speed and new invention And things like fourth dimension. Yet we get a trifle weary With Mr. Einstein's theory. So we must get down to earth at times Relax relieve the tension. And no matter what the progress Or what may yet be proved The simple facts of life are such They cannot be removed.]. You must remember this A kiss is still a kiss a sigh is just a sigh. The fundamental things apply As time goes by.. And when two lovers woo They still say 'I love you.' On that you can rely No matter what the future brings As time goes by.. Moonlight and love songs Never out of date. Hearts full of passion Jealousy and hate. Woman needs man And man must have his mate That no one can deny. It's still the same old story A fight for love and glory A case of do or die. The world will always welcome lovers As time goes by.. {Musical Interlude}. It's still the same old story A fight for love and glory A case of do or die. The world will always welcome lovers As time goes by. 
1944,Bing Crosby,Swinging On A Star,Would you like to swing on a star Carry moonbeams home in a jar And be better off than you are Or would you rather be a mule? A mule is an animal with long funny ears Kicks up at anything he hears His back is brawny but his brain is weak He's just plain stupid with a stubborn streak And by the way if you hate to go to school You may grow up to be a mule. Or would you like to swing on a star Carry moonbeams home in a jar And be better off than you are Or would you rather be a pig?. A pig is an animal with dirt on his face His shoes are a terrible disgrace He has no manners when he eats his food He's fat and lazy and extremely rude But if you don't care a feather or a fig You may grow up to be a pig. Or would you like to swing on a star Carry moonbeams home in a jar And be better off than you are Or would you rather be a fish? A fish won't do anything but swim in a brook He can't write his name or read a book To fool the people is his only thought And though he's slippery he still gets caught But then if that sort of life is what you wish You may grow up to be a fish A new kind of jumped-up slippery fish. And all the monkeys aren't in the zoo Every day you meet quite a few So you see it's all up to you You can be better than you are You could be swingin' on a star 
1944,Judy Garland,Trolley Song,With my high starched-collar and my high-topped shoes And my hair piled high upon my head I went to lose a jolly hour on the trolley And lost my heart instead. With his light brown derby and his bright green tie He was quite the handsomest of men. I started to yen so I counted to ten Then I counted to ten again. Clang clang clang went the trolley Ding ding ding went the bell Zing zing zing went my heart strings From the moment I saw him I fell. Chug chug chug went the motor b__p b__p b__p went the brake Thump thump thump went my heart strings When he smiled I could feel the car shake. He tipped his hat and took a seat. He said he hoped he hadn't stepped upon my feet. He asked my name I held my breath. I couldn't speak because he scared me half to death.. Chug chug chug went the motor Pop pop pop went the wheels Stop stop stop went my heart strings As he started to go then I started to know how it feels When the universe reels. The day was bright the air was sweet The smell of honeysuckle charmed you off your feet. You tried to sing but couldn't squeak In fact you loved him so you couldn't even speak.. Buzz buzz buzz went the buzzer Plop plop plop went the wheels Stop stop stop went my heart strings As he started to leave I took hold of his sleeve with my hand And as if it were planned He stayed on with me and it was grand just to stand With his hand holding mine to the end of the line. 
1944,Jimmy Dorsey,Besame Mucho,Besame besame mucho Each time I cling to your kiss I hear music divine Besame mucho Hold me my darling and say that you'll always be mine This joy is something new My arms enfolding you Never knew this thrill before Whoever thought I'd be Holding you close to me Whispering 'It's you I adore' Dearest one If you should leave me Each little dream would take wing and my life would be through Bsame mucho Love me forever and make all my dreams come true. Besame besame mucho Como si fuera esta noche la ltima vez Bsame mucho Que tengo miedo perderte perderte otra vez Quiero tenerte muy Cerca mirarme en tus Ojos verte junto a m Piensa que tal vez Maana yo ya estar Lejos muy lejos de ti Besame bsame mucho Como si fuera esta noche la ltima vez Besame mucho Que tengo miedo perderte perderte despus 
1945,The Andrews Sisters,Rum & Coca-Cola,If you ever go down Trinidad They make you feel so very glad Calypso sing and make up rhyme Guarantee you one real good fine time Drinkin' rum and Coca-Cola Go down Point Koomahnah Both mother and daughter Workin' for the Yankee dollar. Oh beat it man beat it. Since the Yankee come to Trinidad They got the young girls all goin' mad Young girls say they treat 'em nice Make Trinidad like paradise. Drinkin' rum and Coca-Cola Go down Point Koomahnah Both mother and daughter Workin' for the Yankee dollar. Oh you vex me you vex me. From Chicachicaree to Mona's Isle Native girls all dance and smile Help soldier celebrate his leave Make every day like New Year's Eve. Drinkin' rum and Coca-Cola Go down Point Koomahnah Both mother and daughter Workin' for the Yankee dollar. It's a fact man it's a fact. In old Trinidad I also fear The situation is mighty queer Like the Yankee girl the native swoon When she hear der Bingo croon Drinkin' rum and Coca-Cola Go down Point Koomahnah Both mother and daughter Workin' for the Yankee dollar. Out on Manzanella Beach G.I. romance with native peach All night long make tropic love Next day sit in hot sun and cool off. Drinkin' rum and Coca-Cola Go down Point Koomahnah Both mother and daughter Workin' for the Yankee dollar. It's a fact man it's a fact. Rum and Coca-Cola Rum and Coca-Cola Workin' for the Yankee dollar 
1945,Les Brown,Sentimental Journey,Gonna take a Sentimental Journey Gonna set my heart at ease. Gonna make a Sentimental Journey to renew old memories. Got my bags got my reservations Spent each dime I could afford. Like a child in wild anticipation I Long to hear that 'All aboard!'. Seven...that's the time we leave at seven. I'll be waitin' up at heaven Countin' every mile of railroad track that takes me back.. Never thought my heart could be so yearny. Why did I decide to roam? Gotta take that Sentimental Journey Sentimental Journey home. Sentimental Journey. 
1945,Perry Como,Till The End Of Time,Till the end of time long as stars are in the blue Long as there's a Spring of birds to sing I'll go on loving you Till the end of time long as roses bloom in May My love for you will grow deeper with every passing day Till the wells run dry and each mountain disappears I'll be there for you to care for you through laughter and through tears So take my heart in sweet surrender and tenderly say that I'm The one you love and live for till the end of time. Till the wells run dry and each mountain disappears I'll be there for you to care for you through laughter and through tears So take my heart in sweet surrender and tenderly say that I'm The one you love and live for till the end of time 
1946,Perry Como,Prisoner Of Love,Alone from night to night you'll find me Too weak to break the chains that bind me I need no shackles to remind me I'm just a prisoner of love For one command I stand and wait now From one who's master of my fate now I can't escape for it's too late now I'm just a prisoner of love. What's the good of my caring if someone is sharing those arms with me? Although she has another I can't have another; for I'm not free. [Chorus] She's in my dreams awake or sleeping Upon my knees to her I'm creeping My very life is in her keeping I'm just a prisoner of love. What's the good of my caring if someone is sharing those arms with me? Although she has another I can't have another; for I'm not free 
1946,Eddy Howard,To Each His Own,A rose must remain with the sun and the rain Or its lovely promise won't come true To each his own to each his own And my own is you What good is a song if the words just don't belong? And a dream must be a dream for two No good alone to each his own For me there's you. If a flame is to grow there must be a glow To open each door there's a key I need you I know I can't let you go Your touch means too much to me. Two lips must insist on two more to be kissed Or they'll never know what love can do To each his own I've found my own One and only you. A rose must remain with the sun and the rain Or its lovely promise won't come true To each his own I've found my own One and only you... 
1946,The Ink Spots,The Gypsy,Pd... In a quaint caravan There's a lady they call The Gypsy She can look in the future And drive away all your fears Pd... Everything will come right If you only believe The Gypsy She could tell at a glance That my heart was so full of tears. Pd... She looked at my hand and told me My lover was always true And yet in my heart I knew dear Somebody else was kissing you. Pd... But I'll go there again 'Cause I want to believe The Gypsy That my lover is true And will come back to me some day...Pd. ...Pd... 
1947,Francis Craig,Near You,There's just one place for me near you It's like heaven to be near you Times when we're apart I can't face my heart Say you'll never stray More than just two lips away If my hours could be spent near you I'd be more than content near you Make my life worthwhile By telling me that I'll Spend the rest of my days near you. {instrumental break}. There is just one place for me I'm happy when I'm near you It's wonderful as heaven a special kind of heaven but only when I'm near you Times when we're apart I wonder how I can face my heart Say you'll never stray More than just two lips away. If my waking hours could be spent while near you I would be content wonderfully content just to be near you Make my life worthwhile By telling me that I'll Spend the rest of my days All of those happy happy days So near you. 
1947,The Harmonicats,Peg O' My Heart,Peg o'my heart I love you don't let us part I love you I always knew it would be you Since I heard your lilting laughter It's your Irish heart I'm after Peg o'my heart Your glances make my heart say 'How's chances?' Come be my own come make your home in my heart 
1947,Ted Weems,Heartaches,Heartaches Heartaches My loving you meant only heartaches Your kiss was such a sacred thing to me I can't believe it's just a burning memory Heartaches Heartaches What does it matter how my heart breaks? I should be happy with someone new But my heart aches for you 
1948,Margaret Whiting,A Tree In The Meadow,There's a tree in the meadow With a stream drifting by And carved upon that tree I see 'I love you till I die' Pd... I will always remember The love in your eye The day you carved upon that tree 'I love you till I die'. Pd... But further on down lovers' lane A silhouette I see I know you're kissing someone else I wish that it were me. Pd... By that tree in the meadow My thoughts always lie And wherever you go you'll always know I love you till I die 
1948,Peggy Lee,Manana,The faucet she is dripping and the fence she's fallin' down My pocket needs some money so I can't go into town My brother isn't working and my sister doesn't care The car she needs a motor so I can't go anywhere (mañana mañana mañana is good enough for me) My mother's always working she's working very hard But every time she looks for me I'm sleeping in the yard My mother thinks I'm lazy and maybe she is right I'll go to work mañana but I gotta sleep tonight (mañana mañana mañana is good enough for me). Oh once I had some money but I gave it to my friend He said he'd pay me double it was only for a lend But he said a little later that the horse she was so slow Why he give the horse my money is something I don't know (mañana mañana mañana is good enough for me) (mañana mañana mañana is good enough for me). My brother took a suitcase and he went away to school My father said he only learned to be a silly fool My father said that I should learn to make a chile pot But then I burned the house down the chile was too hot (mañana mañana mañana is soon enough for me) The window she is broken and the rain is comin' in If someone doesn't fix it I'll be soaking to my skin But if we wait a day or two the rain may go away And we don't need a window on such a sunny day (mañana mañana mañana is good enough for me) Oba! Oba! (mañana mañana mañana is good enough for me) Oba! Oba! 
1948,Bing Crosby,Now Is The Hour,Now is the hour When we must say goodbye. Soon you'll be sailing Far across the sea. While you're away Oh then remember me. When you return You'll find me waiting here.. Sunset glow fades in the west. Night o'er the valley is creeping. Birds cuddle down in their nest Soon all the world will be sleeping.. Now is the hour When we must goodbye. Soon you'll be sailing Far across the sea.. While you're away Oh then remember me. When you return You'll find me waiting here. 
1949,Vaughn Monroe,Riders In The Sky,An old cowpoke went riding out one dark and windy day Upon a ridge he rested as he went along his way When all at once a mighty herd of red-eyed cows he saw A'plowin' through the ragged skies and up a cloudy draw  Yi-pi-yi-ay Yi-pi-yi-o Ghost riders in the sky.  Their brands were still on fire and their hooves were made of steel Their horns wuz black and shiny and their hot breaths he could feel A bolt of fear went through him as they thundered through the sky For he saw the riders comin' hard and he heard their mournful cry.  Yi-pi-yi-ay Yi-pi-yi-o Ghost riders in the sky.  Their faces gaunt their eyes were blurred and shirts all soaked with sweat They're ridin' hard to catch that herd but they ain't caught them yet They've got to ride forever in that range up in the sky On horses snortin' fire as they ride on hear their cry.  Yi-pi-yi-ay Yi-pi-yi-o Ghost riders in the sky  As the riders loped on by him he heard one call his name 'If you want to save your soul from hell a' ridin' on our range' 'Then cowboy change your ways today or with us you will ride' 'A-tryin' to catch the Devil's herd across these endless skies.'.  Yi-pi-yi-ay Yi-pi-yi-o Ghost riders in the sky Ghost riders in the sky  
1949,Frankie Laine,That Lucky Old Sun,Up in the mornin' Out on the job Work like the devil for my pay But that lucky old sun got nothin' to do But roll around heaven all day Fuss with my woman toil for my kids Sweat till I'm wrinkled and gray While that lucky old sun got nothin' to do But roll around heaven all day. Dear Lord above can't you know I'm pining tears all in my eyes Send down that cloud with a silver lining lift me to Paradise. Show me that river take me across Wash all my troubles away Like that lucky old sun give me nothing to do But roll around heaven all day. Send down that cloud with a silver lining lift me to Paradise. Show me that river take me across Wash all my troubles away Like that lucky old sun give me nothing to do But roll around heaven all day 
1949,Vic Damone,You're Breaking My Heart,You're breaking my heart 'cause you're leaving You've fallen for somebody new It isn't too easy believing You'd leave after all we've been through It's breaking my heart to remember The dreams we depended upon You're leaving a slow dying ember I'll miss you my love when you're gone. * I wish you joy though teardrops burn But if some day you should want to return Please hurry back and we'll make a new start Till then you're breaking my heart 
1950,Gordon Jenkins And The Weavers,Goodnight Irene,Irene goodnight Irene goodnight Goodnight Irene Goodnight Irene I'll see you in my dreams Last Saturday night I got married Me and my wife settle down Now me and my wife are parted I'm gonna take another stroll down town. Irene goodnight Irene goodnight Goodnight Irene Goodnight Irene I'll see you in my dreams. Sometimes I live in the country Sometimes I live in town Sometimes I have take great notion To jump into the river and drown. Irene goodnight Irene goodnight Goodnight Irene Goodnight Irene I'll see you in my dreams. Stop rambling Stop your gambling Stop staying out late at night Go home to your wife and family Stay there by your fire site ..... Irene goodnight Irene goodnight Goodnight Irene Goodnight Irene I'll see you in my dreams. Goodnight Irene Goodnight Irene I'll see you in my dreams. Goodnight Irene Goodnight Irene I'll see you in my dreams 
1950,Nat King Cole,Mona Lisa,Mona Lisa Mona Lisa men have named you You're so like the lady with the mystic smile Is it only 'cause you're lonely they have blamed you? For that Mona Lisa strangeness in your smile? Do you smile to tempt a lover Mona Lisa? Or is this your way to hide a broken heart? Many dreams have been brought to your doorstep They just lie there and they die there Are you warm are you real Mona Lisa? Or just a cold and lonely lovely work of art?. Do you smile to tempt a lover Mona Lisa? Or is this your way to hide a broken heart? Many dreams have been brought to your doorstep They just lie there and they die there Are you warm are you real Mona Lisa? Or just a cold and lonely lovely work of art?. Mona Lisa Mona Lisa 
