year,artist,track,lyrics
1967,Bobby Gentry,Ode To Billie Joe,It was the third of June another sleepy dusty Delta day I was out choppin' cotton and my brother was balin' hay And at dinner time we stopped and walked back to the house to eat And mama hollered out the back door 'y'all remember to wipe your feet!' And then she said 'I got some news this mornin' from Choctaw Ridge Today Billy Joe MacAllister jumped off the Tallahatchie Bridge.' And papa said to mama as he passed around the blackeyed peas 'Well Billy Joe never had a lick of sense; pass the biscuits please There's five more acres in the lower forty I've got to plow.' And mama said it was shame about Billy Joe anyhow Seems like nothin' ever comes to no good up on Choctaw Ridge And now Billy Joe MacAllister's jumped off the Tallahatchie Bridge. And brother said he recollected when he and Tom and Billie Joe Put a frog down my back at the Carroll County picture show And wasn't I talkin' to him after church last Sunday night? 'I'll have another piece-a apple pie; you know it don't seem right I saw him at the sawmill yesterday on Choctaw Ridge And now ya tell me Billie Joe's jumped off the Tallahatchie Bridge.'. And mama said to me 'Child what's happened to your appetite? I've been cookin' all morning and you haven't touched a single bite That nice young preacher Brother Taylor dropped by today Said he'd be pleased to have dinner on Sunday oh by the way He said he saw a girl that looked a lot like you up on Choctaw Ridge And she and Billy Joe was throwing somethin' off the Tallahatchie Bridge.' A year has come and gone since we heard the news 'bout Billy Joe And brother married Becky Thompson; they bought a store in Tupelo There was a virus going 'round; papa caught it and he died last spring And now mama doesn't seem to want to do much of anything And me - I spend a lot of time pickin' flowers up on Choctaw Ridge And drop them into the muddy water off the Tallahatchie Bridge.  
1968,Beatles,Hey Jude,Hey Jude don't make it bad Take a sad song and make it better Remember to let her into your heart Then you can start to make it better Hey Jude don't be afraid You were made to go out and get her The minute you let her under your skin Then you begin to make it better. And anytime you feel the pain hey Jude refrain Don't carry the world upon your shoulders For well you know that it's a fool who plays it cool By making his world a little colder Nah nah nah nah nah nah nah nah nah. Hey Jude don't let me down You have found her now go and get her Remember to let her into your heart Then you can start to make it better. So let it out and let it in hey Jude begin You're waiting for someone to perform with And don't you know that it's just you hey Jude you'll do The movement you need is on your shoulder Nah nah nah nah nah nah nah nah nah yeah. Hey Jude don't make it bad Take a sad song and make it better Remember to let her under your skin Then you'll begin to make it Better better better better better better oh Nah nah nah nah nah nah nah nah nah hey Jude Nah nah nah nah nah nah nah nah nah hey Jude Nah nah nah nah nah nah nah nah nah hey Jude Nah nah nah nah nah nah nah nah nah hey Jude Nah nah nah nah nah nah nah nah nah hey Jude Nah nah nah nah nah nah nah nah nah hey Jude Nah nah nah nah nah nah nah nah nah hey Jude Nah nah nah nah nah nah nah nah nah hey Jude Nah nah nah nah nah nah nah nah nah hey Jude Nah nah nah nah nah nah nah nah nah hey Jude Nah nah nah nah nah nah nah nah nah hey Jude Nah nah nah nah nah nah nah nah nah hey Jude Nah nah nah nah nah nah nah nah nah hey Jude Nah nah nah nah nah nah nah nah nah hey Jude Nah nah nah nah nah nah nah nah nah hey Jude Nah nah nah nah nah nah nah nah nah hey Jude.  
1968,Paul Mauriat,Love Is Blue,Blue blue my world is blue Blue is my world now I'm without you Gray gray my life is gray Cold is my heart since you went away Red red my eyes are red Crying for you alone in my bed Green green my jealous heart I doubted you and now we're apart. When we met how the bright sun shone Then love died now the rainbow is gone. Black black the nights I've known Longing for you so lost and alone. 
1968,Bobby Goldsboro,Honey,See the tree how big it's grown But friend it hasn't been too long It wasn't big I laughed at her and she got mad The first day that she planted it was just a twig Then the first snow came And she ran out to brush the snow away So it wouldn't die Came runnin' in all excited Slipped and almost hurt herself And I laughed till I cried She was always young at heart Kinda dumb and kinda smart and I loved her so And I surprised her with a puppy Kept me up all Christmas Eve two years ago And it would sure embarrass her When I came in from workin' late 'Cause I would know That she'd been sittin' there and cryin' Over some sad and silly late late show. And honey I miss you And I'm bein' good And I'd love to be with you If only I could. She wrecked the car and she was sad And so afraid that I'd be mad But what the heck Though I pretended hard to be Guess you could say she saw through me And hugged my neck I came home unexpectedly And caught her cryin' needlessly In the middle of the day And it was in the early Spring When flowers bloom and robins sing She went away. And honey I miss you And I'm bein' good And I'd love to be with you If only I could One day while I was not at home While she was there and all alone The angels came Now all I have is memories of Honey And I wake up nights and call her name Now my life's an empty stage Where Honey lived and Honey played And love grew up And a small cloud passes overhead And cries down on the flower bed That Honey loved. And see the tree how big it's grown But friend it hasn't been too long It wasn't big And I laughed at her and she got mad The first day that she planted it was just a twig. 
1969,Archies,Sugar Sugar,Sugar ah honey honey You are my candy girl And you've got me wanting you. Honey ah sugar sugar You are my candy girl And you've got me wanting you. I just can't believe the loveliness of loving you (I just can't believe it's true) I just can't believe the one to love this feeling to. (I just can't believe it's true). Ah sugar ah honey honey You are my candy girl And you've got me wanting you. Ah honey ah sugar sugar You are my candy girl And you've got me wanting you.. When I kissed you girl I knew how sweet a kiss could be (I know how sweet a kiss can be) Like the summer sunshine pour your sweetness over me (Pour your sweetness over me). Sugar pour a little sugar on it honey Pour a little sugar on it baby I'm gonna make your life so sweet yeah yeah yeah Pour a little sugar on it oh yeah Pour a little sugar on it honey Pour a little sugar on it baby I'm gonna make your life so sweet yeah yeah yeah Pour a little sugar on it honey Ah sugar ah honey honey You are my candy girl And you've got me wanting you. Oh honey honey sugar sugar... You are my candy girl.... 
1969,Fifth Dimension,Aquarius / Let The Sunshine In,When the moon is in the Seventh House And Jupiter aligns with Mars Then peace will guide the planets And love will steer the stars This is the dawning of the age of Aquarius Age of Aquarius Aquarius! Aquarius!. Harmony and understanding Sympathy and trust abounding No more falsehoods or derisions Golden living dreams of visions Mystic crystal revelation And the mind's true liberation Aquarius! Aquarius!. When the moon is in the Seventh House And Jupiter aligns with Mars Then peace will guide the planets And love will steer the stars This is the dawning of the age of Aquarius Age of Aquarius Aquarius! Aquarius! Aquarius! Aquarius!. [Instrumental and tempo shift]. Let the sunshine let the sunshine in the sunshine in Let the sunshine let the sunshine in the sunshine in Let the sunshine let the sunshine in the sunshine in [Continue to end with concurrent scat]. Oh let it shine c'mon Now everybody just sing along Let the sun shine in Open up your heart and let it shine on in When you are lonely let it shine on Got to open up your heart and let it shine on in And when you feel like you've been mistreated And your friends turn away Just open your heart and shine it on in. 
1969,Temptations,I Can't Get Next To You,I my my my my Oh I Can turn the gray sky blue I You see I can make it rain when I want it to oh I I can build a castle from a single grain of sand I You see I can make a ship sail on dry land tell 'em yeah I'm unhappy with all the powers I possess yeah Girl you're the key to my happiness and I (I can't get next to you babe ) (I can't get next to you) I've trying a long time (I can't get next to you babe) (I can't get next you) I don't know what to do. I Oh I I oh Lord I can fly like a bird in the sky oh I And I can buy anything that money can buy oh I Can turn a river into a raging fire oh I And I can live forever if I so desire yeah I'm unhappy with all the power I possess yeah girl 'Cause girl your the key cause (I can't get next to you babe) (I can't get next to you) (I can't get next to you babe) (I can't get next to you). Let me tell that I can turn back the hands of time You better believe I can oh I You see I can take the season's change just by waving my hand let me say I I can change anything from old to new girl oh I All the things I want to do the most you see I'm unable to do yeah. Unimportant these things that I'm trying to do here today 'Cause girl you see I (Can't get next to you babe) I've been trying a long time (I can't get next to you) Oh somebody oughta help me (I can't get next to you babe) Let me let me go (I can't get next to you) Let me I Lord I've been working on it baby I've been thinking about it Oh I But you see I've been trying to call you all day long But you see I don't have your phone number honey I I've been I've been thinking about you baby something awful You see I oh I sometimes I feel like I want to moan about it And I I don't just know what to say about it. 
1970,Simon and Garfunkel,Bridge Over Troubled Water,When you're weary feeling small When tears are in your eyes I will dry them all; I'm on your side. When times get rough And friends just can't be found Like a bridge over troubled water I will lay me down. Like a bridge over troubled water I will lay me down. When you're down and out When you're on the street When evening falls so hard I will comfort you. I'll take your part. When darkness comes And pain is all around Like a bridge over troubled water I will lay me down. Like a bridge over troubled water I will lay me down.. Sail on silvergirl Sail on by. Your time has come to shine. All your dreams are on their way. See how they shine. If you need a friend I'm sailing right behind. Like a bridge over troubled water I will ease your mind. Like a bridge over troubled water I will ease your mind.. 
1970,Carpenters,(They Long To Be) Close To You,Close to you Why do birds suddenly appear ev'ry time you are near? Just like me they long to be close to you. Why do stars fall down from the sky ev'ry time you walk by? Just like me they long to be close to you. * Oh the day that you were born the angels got together. And decided to create a dream come true. So they sprinkled moon dust in your hair of gold And star-light in your eyes of blue. That is why all the boys in town follow you all around. Just like me  they long to be close to you... 
1970,Guess Who,American Woman,American woman stay away from me American woman mama let me be Don't come a hangin' around my door I don't want to see your face no more I got more important things to do Than spend my time growin' old with you Now woman I said stay away American woman listen what I say-ay-ay-ay-ay-ay American woman get away from me American woman mama let me be Don't come a knockin' around my door Don't want to see your shadow no more Colored lights can hypnotize Sparkle someone else's eyes Now woman I said get away American woman listen what I say-ay-ay-ay. American woman said get away American woman listen what I say Don't come a hangin' around my door Don't want to see your face no more I don't need your war machines I don't need your ghetto scenes Colored lights can hypnotize Sparkle someone else's eyes Now woman get away from me American woman mama let me be. Go gotta get away gotta get away now go go go I'm gonna leave you woman Gonna leave you woman Bye-bye bye-bye bye-bye bye-bye You're no good for me I'm no good for you Gonna look you right in the eye Tell you what I'm gonna do You know I'm gonna leave You know I'm gonna go You know I'm gonna leave You know I'm gonna go-o woman I'm gonna leave you woman Goodbye American woman Goodbye American chick 
1971,Three Dog Night,Joy To The World,Jeremiah was a bullfrog Was a good friend of mine I never understood a single word he said But I helped him a-drink his wine And he always had some mighty fine wine Singin'... Joy to the world All the boys and girls now Joy to the fishes in the deep blue sea Joy to you and me. If I were the king of the world Tell you what I'd do I'd throw away the cars and the bars and the war Make sweet love to you Sing it now.... Joy to the world All the boys and girls Joy to the fishes in the deep blue sea Joy to you and me. [electric piano]. You know I love the ladies Love to have my fun I'm a high life flyer and a rainbow rider A straight shootin' son-of-a-gun I said a straight shootin' son-of-a-gun. Joy to the world All the boys and girls Joy to the fishes in the deep blue sea Joy to you and me. Joy to the world All the boys and girls Joy to the fishes in the deep blue sea Joy to you and me. Joy to the world All the boys and girls Joy to the world Joy to you and me. Joy to the world All the boys and girls now Joy to the fishes in the deep blue sea Joy to you and me Joy to the world All the boys and girls Joy to the fishes in the deep blue sea Joy to you and me. I want to tell you Joy to the world All the boys and girls Joy to the fishes in the deep blue sea Joy to you and me. Joy to the world All the boys and girls Joy to the fishes in the deep blue sea Joy to you and me. [fading] Joy to the world All the boys and girls 
1971,Rod Steward,Maggie May / (Find A) Reason To Believe,Wake up Maggie I think I got something to say to you. It's late September and I really should be back at school. I know I keep you amused But I feel I'm being used. Oh Maggie I couldn't have tried any more. You led me away from home Just to save you from being alone. You stole my heart and that's what really hurts.. The morning sun when it's in your face Really shows your age. But that don't worry me none. In my eyes you're everything. I laughed at all of your jokes. My love you didn't need to coax. Oh Maggie I couldn't have tried any more. You led me away from home Just to save you from being alone. You stole my soul and that's a pain I can do without.. All I needed was a friend To lend a guiding hand. But you turned into a lover and mother what a lover! You wore me out. All you did was wreck my bed And in the morning kick me in the head Oh Maggie I couldn't have tried any more. You led me away from home 'Cause you didn't want to be alone. You stole my heart. I couldn't leave you if I tried. I suppose I could collect my books And get on back to school. Or steal my daddy's cue And make a living out of playing pool. Or find myself a rock 'n' roll band That needs a helping hand. Oh Maggie I wish I'd never seen your face. You made a first-class fool out of me. But I'm as blind as a fool can be.. If I listened long enough to you I'd find a way to believe that it's all true Knowing that you lied straight-faced while I cried Still I look to find a reason to believe Someone like you makes it hard to live without somebody else Someone like you makes it easy to give never think about myself. If I gave you time to change my mind I'd find a way just to leave the past behind Knowing that you lied straight-faced while I cried Still I look to find a reason to believe. If I listened long enough to you I'd find a way to believe that it's all true Knowing that you lied straight-faced while I cried Still I look to find a reason to believe. Someone like you makes it hard to live without somebody else Someone like you makes it easy to give never think about myself. 
1971,Carole King,It's Too Late / I Feel The Earth Move,Stayed in bed all mornin' just to pass the time. There's somethin' wrong here there can be no denyin'. One of us is changin' or maybe we've just stopped tryin'. And it's too late baby now it's too late though we really did try to make it. Somethin' inside has died and I can't hide and I just can't fake it oh no no.. It used to be so easy livin' here with you. You were light and breezy an' I knew just what to do. Now you look so unhappy and I feel like a fool.. And it's too late baby now it's too late though we really did try to make it. Somethin' inside has died and I can't hide and I just can't fake it oh no no.. There'll be good times again for me and you but we just can't stay together; don't you feel it too? Still I'm glad for what we had and how I once loved you. And it's too late baby now it's too late though we really did try to make it. Somethin' inside has died and I can't hide and I just can't fake it oh no no. no no no no.. I feel the earth move under my feet I feel the sky tumbling down I feel my heart start to trembling Whenever you're around Ooh baby when I see your face Mellow as the month of May Oh darling I can't stand it When you look at me that way. I feel the earth move under my feet I feel the sky tumbling down I feel my heart start to trembling Whenever you're around. Oh darling when you're near me And you tenderly call my name I know that my emotions Are something I just can't tame I've just got to have you baby I feel the earth move under my feet I feel the sky tumbling down I feel the earth move under my feet I feel the sky tumbling down I just lose control Down to my very soul I get hot and cold all over I feel the earth move under my feet I feel the sky tumbling down tumbling down tumbling down.... 
1972,Roberta Flack,The First Time Ever I Saw Your Face,The first time ever I saw your face I thought the sun rose in your eyes And the moon and the stars were the gifts you gave To the dark and the end of the skies And the first time ever I kissed your mouth I felt the earth move in my hand Like the trembling heart of a captive bird That was there at my command my love. And the first time ever I lay with you I felt your heart so close to mine And I knew our joy would fill the earth And last till the end of time my love. The first time ever I saw your face Your face Your face Your face.
1972,Gilbert O'Sullivan,Alone Again (Naturally),In a little while from now If I'm not feeling any less sour I promise myself to treat myself And visit a nearby tower And climbing to the top Will throw myself off In an effort to Make it clear to whoever Wants to know what it's like When you're shattered Left standing in the lurch at a church Were people saying My God that's tough She stood him up No point in us remaining We may as well go home As I did on my own Alone again naturally. To think that only yesterday I was cheerful bright and gay Looking forward to who wouldn't do The role I was about to play But as if to knock me down Reality came around And without so much as a mere touch Cut me into little pieces Leaving me to doubt Talk about God in His mercy Oh if he really does exist Why did he desert me In my hour of need I truly am indeed Alone again naturally. It seems to me that there are more hearts Broken in the world that can't be mended Left unattended What do we do What do we do Alone again naturally. Looking back over the years And whatever else that appears I remember I cried when my father died Never wishing to hide the tears And at sixty-five years old My mother God rest her soul Couldn't understand why the only man She had ever loved had been taken Leaving her to start With a heart so badly broken Despite encouragement from me No words were ever [Spoken] And when she passed away I cried and cried all day Alone again naturally Alone again naturally. 
1972,Don McLean,American Pie,A long long time ago I can still remember how That music used to make me smile And I knew if I had my chance That I could make those people dance And maybe they'd be happy for a while But February made me shiver With every paper I'd deliver Bad news on the doorstep I couldn't take one more step I can't remember if I cried When I read about his widowed bride But something touched me deep inside **The day the music died** So. [Chorus] Bye bye Miss American Pie Drove my Chevy to the levee but the levee was dry Them good ole boys were drinking whiskey in Rye Singin' this'll be the day that I die This'll be the day that I die. Did you write the book of love And do you have faith in God above If the Bible tells you so? Now do you believe in rock and roll? Can music save your mortal soul? And can you teach me how to dance real slow?. Well I know that you're in love with him Cause I saw you dancin' in the gym You both kicked off your shoes Man I dig those rhythm and blues I was a lonely teenage broncin' buck With a pink carnation and a pickup truck But I knew I was out of luck The day the music died I started singin'. [Chorus]. Now for ten years we've been on our own And moss grows fat on a rolling stone But that's not how it used to be When the jester sang for the king and queen In a coat he borrowed from James Dean And a voice that came from you and me Oh and while the king was looking down The jester stole his thorny crown The courtroom was adjourned No verdict was returned And while Lenin read a book on Marx The quartet practiced in the park And we sang dirges in the dark The day the music died We were singin'. [Chorus]. Helter skelter in a summer swelter The birds flew off with a fallout shelter Eight miles high and falling fast It landed foul on the grass The players tried for a forward pass With the jester on the sidelines in a cast Now the half-time air was sweet perfume While sergeants played a marching tune We all got up to dance Oh but we never got the chance Cause the players tried to take the field The marching band refused to yield Do you recall what was revealed The day the music died? We started singin' [Chorus]. Oh and there we were all in one place A generation lost in s___e With no time left to start again So come on Jack be nimble Jack be quick Jack Flash sat on a candlestick Cause fire is the devil's only friend And as I watched him on the stage My hands were clenched in fists of rage No angel born in Hell Could break that Satan's spell And as the flames climbed high into the night To light the sacrificial right I saw Satan laughing with delight The day the music died He was singin'. [Chorus]. I met a girl who sang the blues And I asked her for some happy news But she just smiled and turned away I went down to the sacred store Where I'd heard the music years before But the man there said the music wouldn't play And in the streets the children screamed The lovers cried and the poets dreamed But not a word was spoken The church bells all were broken And the three men I admire most- the Father Son and the Holy Ghost- They caught the last train for the coast The day the music died And they were singing.  
1973,Tony Orlando And Dawn,Tie A Yellow Ribbon Round The Ole Oak Tree,I'm comin' home I've done my time Now I've got to know what is and isn't mine If you received my letter telling you I'd soon be free Then you'll know just what to do If you still want me If you still want me Whoa tie a yellow ribbon 'round the old oak tree It's been three long years Do you still want me? If I don't see a ribbon round the old oak tree I'll stay on the bus Forget about us Put the blame on me If I don't see a yellow ribbon round the old oak tree. Bus driver please look for me 'cause I couldn't bear to see what I might see I'm really still in prison And my love she holds the key A simple yellow ribbon's what I need to set me free I wrote and told her please. Whoa tie a yellow ribbon round the old oak tree It's been three long years Do you still want me? If I don't see a ribbon round the old oak tree I'll stay on the bus Forget about us Put the blame on me If I don't see a yellow ribbon round the old oak tree Now the whole d___ed bus is cheerin' And I can't believe I see A hundred yellow ribbons round the old oak tree. I'm comin' home. 
1973,Jim Croce,Bad Bad Leroy Brown,Well the South side of Chicago Is the baddest part of town And if you go down there You better just beware Of a man named Leroy Brown Now Leroy more than trouble You see he stand 'bout six foot four All the downtown ladies call him 'Treetop Lover' All the men just call him 'Sir'. Chorus: And it's bad bad Leroy Brown The baddest man in the whole d___ed town Badder than old King Kong And meaner than a junkyard dog. Now Leroy he a gambler And he like his fancy clothes And he like to wave his diamond rings In front of everybody's nose He got a custom Continental He got an Eldorado too He got a 32 gun in his pocket for fun He got a razor in his shoe. (Repeat Chorus). Now Friday 'bout a week ago Leroy shootin' dice And at the edge of the bar Sat a girl named Doris And oo that girl looked nice Well he cast his eyes upon her And the trouble soon began 'Cause Leroy Brown learned a lesson 'Bout messin' with the wife of a jealous man (Repeat Chorus). Well the two men took to fighting And when they pulled them off the floor Leroy looked like a jigsaw puzzle With a couple of pieces gone
