year,artist,track,lyrics
1988,George Michael,Faith,Well I guess it would be nice If I could touch your body I know not everybody Has got a body like you But I've got to think twice Before I give my heart away And I know all the games you play Because I play them too. Oh but I Need some time off from that emotion Time to pick my heart up off the floor And when that love comes down Without devotion Well it takes a strong man baby But I'm showing you the door. 'Cause I gotta have faith.... Baby I know you're asking me to stay Say please please please don't go away You say I'm giving you the blues Maybe You mean every word you say Can't help but think of yesterday And another who tied me down to lover boy rules Before this river Becomes an ocean Before you throw my heart back on the floor Oh baby I reconsider My foolish notion Well I need someone to hold me But I'll wait for something more. Yes I've gotta have faith.
1988,INXS,Need You Tonight,Come over here. All you got is this moment The twenty-first century's yesterday You can care all you want Everybody does yeah that's okay So slide over here And give me a moment Your moves are so raw I've got to let you know I've got to let you know You're one of my kind. I need you tonight 'Cause I'm not sleeping There's something about you girl That makes me sweat. How do you feel I'm lonely What do you think Can't take it all What ya gonna do Gonna live my life. 
1988,George Harrison,Got My Mind Set On You,I got my mind set on you I got my mind set on you I got my mind set on you I got my mind set on you But it's gonna take money A whole lot of spending money It's gonna take plenty of money To do it right child. It's gonna take time A whole lot of precious time It's gonna take patience and time um To do it to do it to do it to do it to do it To do it right child. [Chorus]. And this time I know it's for real The feelings that I feel I know if I put my mind to it I know that I really can do it. I got my mind set on you Set on you I got my mind set on you Set on you. But it's gonna take money A whole lot of spending money It's gonna take plenty of money To do it right child. It's gonna take time A whole lot of precious time It's gonna take patience and time um To do it to do it to do it to do it to do it To do it right child [Chorus]. And this time I know it's for real The feelings that I feel I know if I put my mind to it I know that I really can do it. But it's gonna take money A whole lot of spending money It's gonna take plenty of money To do it right child. It's gonna take time A whole lot of precious time It's gonna take patience and time um To do it to do it to do it to do it to do it To do it right. Set on you Set on you. 
1989,Chicago,Look Awa,When you called me up this morning Told me 'bout the new love you found I'm said 'I'm happy for you I'm really happy for you.' Found someone else I guess I won't be coming 'round. I guess it's over baby; It's really over baby whoa... And from what you said I know you've gotten over me; It'll never be the way it used to be. So if it's gotta be this way Don't worry baby I can take the news okay.. [Chorus:] But if you see me walking by And the tears are in my eyes Look away baby look away. If we meet on the streets someday And I don't know what to say Look away baby look away. Don't look at me; I don't want you to see me this way.. When we both agreed as lovers We were better off as friends That's how it had to be Yeah that's how it had to be. I tell you I'm fine But sometimes I just pretend; Wish you were holding me Wish you were still holding me whoa... I just never thought That I would be replaced so soon; I wasn't prepared to hear those words from you. I know I wanted to be free; Yeah baby this is how we wanted it to be. [Chorus 2x]. When you called me up this morning Told me 'bout the new love you found. I said 'I'm happy for you I'm really happy for you.'.
1989,Bobby Brown,My Prerogative,Everybody's talkin' all this stuff about me. Why don't they just let me live? I don't need permission; make my own decisions. That's my prerogative. It's my prerogative. It's the way that I wanna live. It's my prerogative. I can do just what I feel. It's my prerogative. No one can tell me what to do. It's my prerogative. 'Cause what I'm doin' I'm doin' for you.. They say I'm crazy. I really don't care. That's my prerogative. They say I'm nasty. But I don't give a d___. Gettin' girls is how I live.. Some asks me question: Why am I so real? But they don't understand me Or really don't know the deal about the brother. Trying hard to make it right Not long ago before I won this fight.. Everybody's talkin' all this stuff about me. Why don't they just let me live? I don't need permission; make my own decisions. That's my prerogative. It's my prerogative. It's the way that I wanna live. It's my prerogative. I can do just what I feel. It's my prerogative. No one can tell me what to do. It's my prerogative. 'Cause what I'm doin' I'm doin' for you.. Don't get me wrong I'm really not looped. Ego trips is not my thing. All these strange relationships really gets me down. I see nothing wrong with spreading myself around.. Everybody's talkin' all this stuff about me. Why don't they just let me live? I don't need permission; make my own decisions. That's my prerogative. It's my prerogative. It's the way that I wanna live. It's my prerogative. I can do just what I feel. It's my prerogative. No one can tell me what to do. It's my prerogative. 'Cause what I'm doin' I'm doin' for you. Everybody's talkin' all this stuff about me. Why don't they just let me live? I don't need permission; make my own decisions. That's my prerogative. It's my prerogative. It's the way that I wanna live. It's my prerogative. I can do just what I feel. It's my prerogative. No one can tell me what to do. It's my prerogative. Tell me tell me why can't I live my life (live my life) without all of the things that people say?. Everybody's talkin' all this stuff about me. Why don't they just let me live? I don't need permission; make my own decisions. That's my prerogative. It's my prerogative. It's the way that I wanna live. It's my prerogative. I can do just what I feel. It's my prerogative. No one can tell me what to do. It's my prerogative. It's my prerogative..
1989,Poison,Every Rose Has Its Thorn,We both lie silently still In the dead of the night Although we both lie close together We feel miles apart inside Was it something I said or something I did Did my words not come out right Though I tried not to hurt you Though I tried But I guess that's why they say. [Chorus:] Every rose has its thorn Just like every night has it's dawn Just like every cowboy sings his sad sad song Every rose has its thorn. Yeah it does I listen to your favorite song Playing on the radio Hear the DJ say love's a game of Easy come and easy go But I wonder does he know Has it ever felt like this And I know that you'd be here right now If I could have let you know somehow I guess. [Chorus] Though it's been a while now I can still feel so much pain Like the knife that cuts you The wound heals but the scar that scar remains I know I could have saved our love that night If I'd known what to say Instead if making love We both made our separate ways Now I hear you've found somebody new And that I never meant that much to you To hear that tears me up inside And to see you cuts me like a knife. 
1990,Wilson Phillips,Hold On,I know there's pain Why do lock yourself up in these chains? No one can change your life except for you Don't ever let anyone step all over you Just open your heart and your mind Is it really fair to feel this way inside? Some day somebody's gonna make you want to Turn around and say goodbye Until then baby are you going to let them Hold you down and make you cry Don't you know? Don't you know things can change Things'll go your way If you hold on for one more day Can you hold on for one more day Things'll go your way Hold on for one more day. You could sustain Or are you comfortable with the pain? You've got no one to blame for your unhappiness You got yourself into your own mess Lettin' your worries pass you by Don't you think it's worth your time To change your mind?. Some day somebody's gonna make you want to Turn around and say goodbye Until then baby are you going to let them Hold you down and make you cry Don't you know? Don't you know things can change Things'll go your way If you hold on for one more day Can you hold on for one more day Things'll go your way Hold on for one more day. I know that there is pain But you hold on for one more day and Break free the chains Yeah I know that there is pain But you hold on for one more day and you Break free break from the chains. Some day somebody's gonna make you want to Turn around and say goodbye Until then baby are you going to let them Hold you down and make you cry Don't you know? Don't you know things can change Things'll go your way If you hold on for one more day yeah If you hold on Don't you know things can change Things'll go your way If you hold on for one more day If you hold on Can you hold on Hold on baby Won't you tell me now Hold on for one more day 'Cause It's gonna go your way. Don't you know things can change Things'll go your way If you hold on for one more day Can't you change it this time. Make up your mind Hold on Hold on Baby hold on. 
1990,Roxette,It Must Have Been Love,Lay a whisper on my pillow leave the winter on the ground. I wake up lonely there's air of silence in the bedroom and all around. Touch me now I close my eyes and dream away.. It must have been love but it's over now. It must have been good but I lost it somehow. It must have been love but it's over now. From the moment we touched 'til the time had run out.. Make-believing we're together that I'm sheltered by your heart. But in and outside I've turned to water like a teardrop in your palm. And it's a hard winter's day I dream away.. It must have been love but it's over now it was all that I wanted now I'm living without. It must have been love but it's over now it's where the water flows it's where the wind blows it's where the wind blows It must have been love but it's over now it was all that I wanted now I'm living without. It must have been love but it's over now it's where the water flows.
1990,Sinead O'Conner,Nothing Compares 2 U,It's been seven hours and fifteen days Since you took your love away I go out every night and sleep all day Since you took your love away Since you been gone I can do whatever I want I can see whomever I choose I can eat my dinner in a fancy restaurant But nothing I said nothing can take away these blues `Cause nothing compares Nothing compares to you. It's been so lonely without you here Like a bird without a song Nothing can stop these lonely tears from falling Tell me baby where did I go wrong I could put my arms around every boy I see But they'd only remind me of you I went to the doctor n'guess what he told me Guess what he told me He said girl u better try to have fun No matter what you'll do But he's a fool `Cause nothing compares Nothing compares to you all the flowers that you planted mama In the back yard All died when you went away I know that living with you baby was sometimes hard But I'm willing to give it another try Nothing compares Nothing compares to you Nothing compares Nothing compares to you Nothing compares Nothing compares to you. 
1991,Bryan Adams,(Everything I Do) I Do It For You,Look into my eyes you will see What you mean to me Search your heart search your soul And when you find me there you'll search no more Don't tell me it's not worth tryin' for You can't tell me it's not worth dyin' for You know it's true Everything I do I do it for you. Look into your heart you will find There's nothin' there to hide Take me as I am take my life I would give it all I would sacrifice. Don't tell me it's not worth fightin' for I can't help it there's nothin' I want more You know it's true Everything I do I do it for you Oh yeah. There's no love like your love And no other could give more love There's nowhere unless you're there All the time all the way yeah. Look into your heart baby. Oh you can't tell me it's not worth tryin' for I can't help it there's nothin' I want more Yeah I would fight for you I'd lie for you Walk the wire for you yeah I'd die for you. You know it's true Everything I do oh I do it for you Everything I do darling And we'll see it through Oh we'll see it through Oh yeah. Yeah!. Look into your heart You can't tell me it ain't worth dying for Oh yeah. I'll be there yeah I'll walk the wire Oh yeah. I'm going all the way all they way yeah.  
1991,Color Me Badd,I Wanna Sex You Up,Come inside take off your coat I'll make you feel at home Now let's pour a glass of wine cuz now we're all alone I've been waiting for you girl just let me hold you close to me Cuz I've been dying for you girl to make love to me Girl you make me feel real good We can do it til we both wake up Girl you know I'm hooked on you And this is what I'll do. I wanna sex you All night You make me feel good I wanna rub you down I wanna sex you up. Let me take off all your clothes Disconnect the phone so nobody knows Let me light a candle So we can make it better Makin love until we drown. Girl you know it feels real good We can do it til we both wake up Girl you know I'm hooked on you And this is what I'll do. I wanna sex you up Makin' love until we drown I wanna sex you up All I wanna do is I wanna sex you up All night Girl you make me feel good I wanna rub you down I wanna sex you up. Make sweet lovin all night long I wanna sex you up Feels so right it can't be wrong Don't be shy girl rescue me I wanna sex you up Open up your heart and I'll set you free. 
1991,C+C Music Factory,Gonna Make You Sweat,Everybody dance now (x2) Give me the music (x2) Everybody dance now (x2) Yeah yeah yeah Everybody dance now Yeah yeah yeah Everybody Here is the dome back with the bass The jam is live in effect and I don't waste time Off the mic with a dope rhyme jump to the rhythm Jump jump to the rhythm jump And I'm here to combine beats and lyrics To make you shake your pants take a chance Come on and dance guys grab a girl don't wait make the twirl It's your world and I'm just a squirrel Trying to get a nut to move your b___ to the dance floor So you what's up hands in the air come on say yeah Everybody over here everybody over there The crowd is live enough as I pursure this groove Party people in the house move. Left to right (groove) work me all night Come on let's sweat (sweat sweat) baby Let the music take control (control control) Let the rhythm move you Sweat (sweat sweat) sweat Let the music take your soul (soul soul) Let the rhythm move you Everybody dance now. Da da da da da da da da da da da da Da da da da da da da da Da da da da da da da da da da da da (x2) (Ooh) REPEAT. (Move) everybody dance now Everybody dance now. Pause take a breath and go for yours on my command Now hit the dance floor it's gonna make you sweat till you bleed Is that dope enough indeed I paid the price to control the dice I'm more precise to the point I'm nice Let the music take control of your heart and soul Unfold your body is free and behold Dance till you can't dance till you can't dance no more Get on the floor and get ablow Then come back and upside down easy now Let me see you move left to right groove Work me all night The music is my life Everybody dance now (x3) Everybody. Come on let's sweat (sweat sweat) baby Let the music take control (control control) Let the rhythm move you Sweat (sweat sweat) sweat Let the music take your soul (soul soul) Let the rhythm move you. 
1992,Boyz II Men,End Of The Road,Girl you know we belong together I don't have time for you to be playing with my heart like this You'll be mine forever baby You just wait We belong together And you know that I am right Why do you play with my heart Why do you play with my mind. Said we'd be forever Said it'd never die How could you love me and leave me and never Say goodbye. When I can't sleep at night Without holding you tight Girl each time I try I just break down and cry Pain in my head Oh I'd rather be dead Spinning around and around. [Chorus:Repeat x2] Although we've come To the end of the road Still I can't let go It's unnatural You belong to me I belong to you. Girl I know you really love me You just don't realize You've never been there before It's only Your first time. Maybe I'll forgive you Maybe you'll try We should be happy together forever You and I. Will you love me again Like you loved me before This time I want you to love me much more This time instead Just come to my bed And baby just don't let me go. [Chorus]. Girl I'm here for you All those time as night When you just hurt me And just ran out with that other fella Baby I knew about it I just didn't care You just don't understand how much I love Do you? I'm here for you I'm not about to go out on cheat you (Maybe I'll forgive you) Just like you did But baby that's alright I love you anyway (Maybe you will try) And I'm still going to be here with you until my dying day (We should be happy together forever) Right now I'm just in so much pain Cause you just won't come back to me (You and I) Will you? Just come back. (Lonely) Yes baby my heart is lonely (Lonely) My heart hurts (Lonely) Yes I feel pain too Baby please. This time instead just come to my bed And baby just don't let me go. 
1992,Sir Mix A Lot,Baby Got Back,Oh my god. Becky look at her b___. It is so big. *scoff* She looks like one of those rap guys' girlfriends. But why'know who understands those rap guys? *scoff* They only talk to her because she looks like a total prostitute 'kay? I mean her b___ is just so big. *scoff* I can't believe it's just so round it's like out there I mean - gross. Look! She's just so ... black!. [Sir Mix-a-Lot] I like big b___s and I can not lie You other brothers can't deny That when a girl walks in with an itty bitty waste And a round thing in your face You get sprung want to pull up tough 'Cause you notice that b___ was stuffed Deep in the jeans she's wearing I'm hooked and I can't stop staring Oh baby I want to get wit'cha And take your picture My homeboys tried to warn me But with that b___ you got makes <Me so h____> Ooh Rump-o'-smooth-skin You say you want to get in my Benz? Well use me use me 'Cause you ain't that average groupy I've seen them dancin' The hell with romancin' She's wet wet Got it goin' like a turbo 'Vette I'm tired of magazines Sayin' flat b___s are the thing Take the average black man and ask him that She gotta pack much back So fellas! (Yeah!) Fellas! (Yeah!) Has your girlfriend got the b___? (Hell yeah!) Tell 'em to shake it! (Shake it!) Shake it! (Shake it!) Shake that healthy b___! Baby got back!. (LA face with Oakland booty) Baby got back!. [Sir Mix-a-Lot] I like 'em round and big And when I'm throwin' a gig I just can't help myself I'm actin' like an animal Now here's my scandal I want to get you home And ugh double-up ugh ugh I ain't talkin' bout Playboy 'Cause silicone parts are made for toys I want 'em real thick and juicy So find that juicy double Mix-a-Lot's in trouble Beggin' for a piece of that bubble So I'm lookin' at rock videos Watchin' these bimbos walkin' like hoes You can have them bimbos I'll keep my women like Flo Jo A word to the thick soul sistas I want to get with ya I won't cuss or hit ya But I gotta be straight when I say I want to *f___* Til the break of dawn Baby got it goin' on A lot of simps won't like this song 'Cause them punks like to hit it and quit it And I'd rather stay and play 'Cause I'm long and I'm strong And I'm down to get the friction on So ladies! {Yeah!} Ladies! {Yeah} If you want to role in my Mercedes {Yeah!} Then turn around! Stick it out! Even white boys got to shout Baby got back! Baby got back! Yeah baby ... when it comes to females Cosmo ain't got nothin' to do with my selection. 36-24-36? Ha ha only if she's 5'3'.. [Sir Mix-a-Lot] So your girlfriend rolls a Honda playin' workout tapes by Fonda But Fonda ain't got a motor in the back of her Honda My anaconda don't want none Unless you've got buns hon You can do side bends or sit-ups But please don't lose that b___ Some brothers want to play that 'hard' role And tell you that the b___ ain't go So they toss it and leave it And I pull up quick to retrieve it So Cosmo says you're fat Well I ain't down with that! 'Cause your waste is small and your curves are kickin' And I'm thinkin' bout stickin' To the beanpole dames in the magazines: You ain't it Miss Thing! Give me a sista I can't resist her Red beans and rice didn't miss her Some knucklehead tried to dis 'Cause his girls are on my list He had game but he chose to hit 'em And I pull up quick to get wit 'em So ladies if the b___ is round And you want a triple X throw down Dial 1-900-MIXALOT And kick them nasty thoughts Baby got back!. (Little in the middle but she got much back). 
1992,Kris Kross,Jump,Jump Jump You should know you should know that ahhh Kris Kross is not having anything today As we stand there totally krossed out We commence to make you Jump Jump The Mac Dad will make you Jump Jump The Daddy Mac will make you Jump Jump Kris Kross will make you Jump Jump. Don't try to compare us to another bad little fad I'm the Mac and I'm bad give you something that you never had I'll make ya Jump Jump wiggle and shake your rump Cause I'll be kicking the flavor that makes you wanna Jump How high? Real high Cause I'm just so fly A young loveable hugable type of guy And everything is the back with a little slack Cause inside-out is wiggida wiggida wack I come stompin' with somethi' to keep you jumpin R&B abd bullcrap is what I'm dumpin' And ain't something about Kris Kross we all that So when they ask to the rocks they believe that. Jump Jump The Mac Dad will make you Jump Jump The Daddy Mac will make you Jump Jump Kris Kross will make you Jump Jump uh huh uh huh Jump Jump The Mac Dad will make you Jump Jump The Daddy Mac will make you Jump Jump Kris Kross will make you Jump Jump. I let myself knockin' knockin' I love it when a girl is play jockin' jockin' The D-A-double D-Y-M-A-C Ya you know me I got you jumpin' an' pumpin' an' movin' all around G In the mix I make ya six step back They try to step to the Mac then they got jacked To the back you'll be sportin' the gear that's coincidental And like you knowit so don't be claiming that it's mental. Two lil' kids with a flow you ain't ever heard And none faking you can understand every word As you listen to my cool school melody The Daddy makes you J-U-M-P. Jump Jump The Mac Dad will make you Jump Jump The Daddy Mac will make you Jump Jump Kris Kross will make you Jump Jump uh huh uh huh Jump Jump The Mac Dad will make you Jump Jump The Daddy Mac will make you Jump Jump Kris Kross will make you Jump Jump Now the formalities of this and that Is that Kris Kross ain't comin' off wack And for all ya'll suckers that don't know Check it out. Some of them try to rhyme but they can't rhyme like this Go Go Some of them try to rhyme but they can't rhyme like this Go Go Some of them try to rhyme but they can't rhyme like this Go Go Some of them try to rhyme but they can't Go Go Cause I'm the miggida miggida miggida Mac Daddy Miggida miggida miggida Mac Cause I'm the miggida miggida miggida Mac Daddy. I make you wanna Jump Jump The Mac Dad will make you Jump Jump The Daddy Mac will make you Jump Jump Kris Kross will make you Jump Jump uh huh uh huh (repeat 3 more times) Believe dat. 
1993,Whitney Houston,I Will Always Love You,If I Should stay I would only be in your way So I'll go But I know I'll think of you every step of the way And I... Will always Love you oohh Will always Love you You My darling you Mmm-mm. Bittersweet Memories That is all I'm taking with me So good-bye Please don't cry We both know I'm not what you You need. And I... Will always love you I... Will always love you You ooh. [Instrumental / Sax solo]. I hope life treats you kind And I hope you have all you've dreamed of And I wish you joy and happiness But above all this I wish you love And I... Will always love you I... Will always love you [Repeat]. I I will always love You.... You Darling I love you I'll always I'll always Love You.. Oooh Ooohhh. 
