year,artist,track,lyrics
2003,R. Kelly,Ignition,Now usually I dont do this but uh.... Go head' on and break em off wit a lil' preview of the remix..... No I'm not tryin to be rude But hey pretty girl I'm feelin you The way you do the things you do Remind me of my Lexus coup Thats why im all up in yo grill Tryina get you to a hotel You must be a football coach The way you got me playin the field. So baby gimme that toot toot Lemme give you that beep beep Runnin her hands through my 'fro Bouncin on 24's While they say on the radio.... It's the remix to ignition Hot and fresh out the kitchen Mama rollin that body got every man in here wishin Sippin on c__e and rum I'm like so what I'm drunk It's the freakin weekend baby I'm about to have me some fun. Bounce Bounce Bounce Bounce Bounce Bounce Bounce Bounce Bounce Bounce. Now it's like murder she wrote Once I get you out them clothes Privacy is on the door Still they can hear you screamin more Girl I'm feelin what you feelin No more hopin and wishin I'm bout to take my key and Stick it in the ignition. So baby gimme that toot toot Lemme give you that beep beep Runnin her hands through my 'fro Bouncin on 24's While they say on the radio.... This is the remix to ignition Hot and fresh out the kitchen Mama rollin that body Got every man in here wishin Sippin on c__e and rum I'm like so what i'm drunk It's the freakin weekend baby I'm about to have me some fun. Crystall poppin in the stretch Navigator We got food every where As if the party was catored We got fellas to my left Hunnies on my right We bring em both together we got junkin all night Then after the show its the (after party) And after the party its the (hotel lobby) And round about 4 you gotta (clear the lobby) Then head take it to the room and freak somebody Can I get a toot toot Can I get a beep beep Runnin her hands through my 'fro Bouncin on 24's While they say on the radio.... This is the remix to ignition Hot and fresh out the kitchen Mama rollin that body Got every man in here wishin Sippin on c__e and rum I'm like so what I'm drunk It's the freakin weekend baby I'm about to have me some fun. This is the remix to ignition Hot and fresh out the kitchen Mama rollin that body Got every man in here wishin Sippin on c__e and rum I'm like so what I'm drunk It's the freakin weekend baby I'm about to have me some fun. Girl we off in this jeep Foggin windows up Blastin the radio In the back of my truck Bouncin up and down Stroke it round and round To the remix We just thuggin it out.
2003,Sean Paul,Get Busy,Shake that thing Miss Kana Kana Shake that thing Miss Annabella Shake that thing yan Donna Donna Jodi and Rebecca Woman Get busy Just shake that booty non-stop When the beat drops Just keep swinging it Get jiggy Get crunked up Percolate anything you want to call it Oscillate you hip and don't take pity Me want fi see you get live upon the riddim when me ride And me lyrics a provide electricity Gal nobody can tell you nuttin Can you done know your destiny. Yo sexy ladies want par with us In a the car with us Them nah war with us In a the club them want flex with us To get next to us Them cah vex with us From the day me born jah ignite me flame gal a call me name and its me fame Its all good girl turn me on Til a early mornin Let's get it on Let's get it on til a early morning Girl it's all good just turn me on. Woman don't sweat it don't get agitate just gwaan rotate Can anything you want you know you must get it From you name a mentuin Don't ease the tension just run the program gals wan pet it Just have a good time Gal free up unu mind caw nobody can dis you man won't let it can You a the number one gal Wave you hand Make them see you wedding band. Yo sexy ladies want par with us In a the car with us Them nah war with us In a the club them want flex with us To get next to us Them cah vex with us From the day me born jah ignite me flame gal a call me name and its me fame Its all good girl turn me on Til a early mornin Let's get it on Let's get it on til a early morning Girl it's all good just turn me on. Woman Get busy  Just shake that booty non-stop When the beat drops Just keep swinging it Get jiggy Get crunked up Percolate anything you want to call it Oscillate you hip and don't take pity Me want fi see you get live pon the riddim when me ride And me lyrics a provide electricity Gal nobody can tell you nuttin Can you done know your destiny. Yo sexy ladies want par with us In a the car with us Them nah war with us In a the club them want flex with us To get next to us Them cah vex with us From the day me born jah ignite me flame gal a call me name and its me fame Its all good girl turn me on Til a early mornin Let's get it on Let's get it on til a early morning Girl it's all good just turn me on. Yo Shake that thing Miss Kana Kana shake that thing Yo Annabella shake that thing Miss Donna Donna Yo Miss Jodi you're di one and Rebecca shake that thing Yo shake that thing Yo Joanna shake that thing Yo Annabella shake that think Miss Kana Kana so me go so then. Yo sexy ladies want par with us In a the car with us Them nah war with us In a the club them want flex with us To get next to us Them cah vex with us From the day me born jah ignite me flame gal a call me name and its me fame Its all good girl turn me on Til a early mornin Let's get it on Let's get it on til a early morning Girl it's all good just turn me on. Yo sexy ladies want par with us In a the car with us Them nah war with us In a the club them want flex with us To get next to us Them cah vex with us From the day me born jah ignite me flame gal a call me name and its me fame Its all good girl turn me on Til a early mornin Let's get it on Let's get it on til a early morning Girl it's all good just turn me on. Let's get it on until a early morning Girl it's all good just turn me on.  
2004,Usher,Yeah,Peace up! A Town Down!. Yeah (Yeah!) OK! (Usher! Usher! Usher! Usher!). Lil' Jon!. Yeah Yeah Yeah! Yeah Yeah! Yeaah! Yeah Yeah Yeah! Yeah Yeah! Yeaah!. Up in the club with my homies tryna get a lil' V-I but keep it down on the low key 'cause you know how it is. I saw shorty she was checkin' up on me from the game she was spittin' in my ear you would think that she knew me. So we decided to chill. Conversation got heavy she had me feelin' like she's ready to blow! (Watch Out! Oh! Watch Out!) She's saying 'Come get me! Come get me' So I got up and followed her to the floor she said 'Baby let's go' That's when I told her I said. Yeah (yeah) Shorty got down low and said come and get me Yeah (yeah) I got so caught up I forgot she told me Yeah (yeah) Her and my girl used to be the best of homies Yeah (yeah) Next thing I knew she was all up on me screaming:. Yeah Yeah Yeah! Yeah Yeah! Yeaah! Yeah Yeah Yeah! Yeah Yeah! Yeaah!. So she's all up in my head now got me thinking that it might good idea to take her with me 'Cause she's ready to leave (ready to leave) But I gotta keep it real now 'cause on a one to ten she's a certified twenty but that just ain't me. Hey.. Because I don't know if I take that chance just where it's gonna lead But what I do know is the way she dance makes shorty alright with me. The way she (get low!) I'm like yeah just work that out for me. She asked for one more dance and I'm Like yeah how the hell am I supposed to leave? And I said [Chorus]. Hey Luda!. Watch out! My outfit's ridiculous in the club lookin' so conspicuous. And Rowl! These women all on the prowl if you hold the head steady I'm a milk the cow. Forget about the game I'm a spit the truth I won't stop till I get 'em in they birthday suits. So gimmie the rhythm and it'll be off with their clothes then bend over to the front and touch your toes. I left the Jag and I took the Rolls if they aint cutting then I put em on foot patrol. How you like me now when my pinky's valued over three hundred thousand Lets drank you the one to please Ludacris fill cups like double D's. Me and Ursh once more and we leave 'em dead we want a lady in the street but a freak in the bed to say.  Take that and rewind it back Lil' Jon got the beat to make ya booty go (clap) Take that and rewind it back Ursher got the voice to make ya booty go (clap) Take that and rewind it back Ludacris got the flow to make ya booty go (clap) Take that and rewind it back Lil' Jon got the beat to make ya booty go (clap).  
2004,Usher,Burn,Girl understand why See it's burning me to hold onto this I know this is something I gotta do But that don't mean I want to What I'm trying to say is that I-love-you I just I feel like this is coming to an end And its better for me to let it go now than hold on and hurt you I gotta let it burn [Verse 1] It's gonna burn for me to say this But it's coming from my heart It's been a long time coming But we done been fell apart Really wanna work this out But I don't think ya gonna change ya I do but you don't Think it's best we go our separate ways Tell me why I should stay in this relationship When I'm hurting baby I ain't happy baby Plus there's so many other things I gotta deal with I think that you should let it burn. [Chorus] When your feeling ain't the same and your body don't want to But you know gotta let it go cause the party ain't jumpin' like it used to Even though this might bruise you Let it burn Let it burn Gotta let it burn. Deep down you know it's best for yourself but you Hate the thought of her being with someone else But you know that it's over You know that it was through Let it burn Let it burn Gotta let it burn. [Verse 2] Sendin' pages I ain't supposed to Got somebody here but I want you Cause the feeling ain't the same find myself Callin' her your name Ladies tell me do you understand? Now all my fellas do you feel my pain? It's the way I feel I know I made a mistake Now it's too late I know she ain't coming back What I gotta do now To get my shorty back Oh oh oh oh Man I don't know what I'm gonna do Without my boo You've been gone for too long It's been fifty-eleven days um-teen hours I'mma be burnin' till you return (let it burn). [Chorus] Deep down you know it's best for yourself but you Hate the thought of her being with someone else But you know that it's over You know that it was through Let it burn Let it burn Gotta let it burn. [Bridge] I'm twisted cause one side of me is tellin' me that I need to move on On the other side I wanna break down and cry (oh) I'm twisted cause one side of me is tellin' me that I need to move on On the other side I wanna break down and cry (yeah). Oh oh oh oh oh oh Oh oh oh (can you feel me burnin'?) Oh oh oh oh oh oh. So many days so many hours I'm still burnin' till you return. [Chorus]. Deep down you know it's best for yourself but you Hate the thought of her being with someone else But you know that it's over You know that it was through Let it burn Let it burn Gotta let it burn.  
2004,Alicia Keys,If I Ain't Got You,Some people live for the fortune Some people live just for the fame Some people live for the power Some people live just to play the game Some people think that the physical things define what's within And I have been there before and that life's a bore So full of the superficial. Some people want it all But I don't want nothing at all If it ain't you baby If I ain't got you baby Some people want diamond rings Some just want everything But everything means nothing If I ain't got you. Some people search for a fountain That promises forever young Some people need three dozen roses And that's the only way to prove you love them. Hand me the world on a silver platter And what good would it be With no one to share with no one who truly cares for me. Some people want it all But I don't want nothing at all If it ain't you baby If I ain't got you baby Some people want diamond rings Some just want everything But everything means nothing If I ain't got you Some people want it all But I don't want nothing at all If it ain't you baby If I ain't got you baby Some people want diamond rings Some just want everything But everything means nothing If I ain't got you. If I ain't got you with me baby Nothing in this whole wide world don't mean a thing If I ain't got you with me baby.
2005,Mariah Carey,We Belong Together,(Ooh ooh sweet love yeah). I didn't mean it When I said I didn't love you so I should have held on tight I never shoulda let you go I didn't know nothing I was stupid I was foolish I was lying to myself I could not fathom that I would ever Be without your love Never imagined I'd be Sitting here beside myself Cause I didn't know you Cause I didn't know me But I thought I knew everything I never felt. The feeling that I'm feeling Now that I don't hear your voice Or have your touch and kiss your lips Cause I don't have a choice Oh what I wouldn't give To have you lying by my side Right here cause baby (We belong together). [Chorus] When you left I lost a part of me It's still so hard to believe Come back baby please Cause we belong together. Who else am I gon' lean on When times get rough Who's gonna talk to me on the phone Till the sun comes up Who's gonna take your place There ain't nobody better Oh baby baby we belong together. I can't sleep at night When you are on my mind Bobby Womack's on the radio Saying to me 'If you think you're lonely now' Wait a minute This is too deep (too deep) I gotta change the station So I turn the dial Trying to catch a break And then I hear Babyface I only think of you And it's breaking my heart I'm trying to keep it together But I'm falling apart. I'm feeling all out of my element I'm throwing things crying Trying to figure out Where the hell I went wrong The pain reflected in this song It ain't even half of what I'm feeling inside I need you Need you back in my life baby [Chorus]. Who else am I gon' lean on When times get rough Who's gonna talk to me on the phone Till the sun comes up Who's gonna take your place There ain't nobody better Oh baby baby we belong together baby. [Chorus]. Who am I gonna lean on When times get rough Who's gonna talk to me Till the sun comes up Who's gonna take your place There ain't nobody better Oh baby baby We belong together. 
2005,Gwen Stefani,Hollaback Girl,This my shit All the girls stamp your feet like this. Few times I've been around that track So it's not just gonna happen like that Cuz I ain't no hollaback girl I ain't no hollaback girl Few times I've been around that track So it's not just gonna happen like that Cuz I ain't no hollaback girl I ain't no hollaback girl. This my shitthis my shit This my shitthis my shit This my shitthis my shit This my shitthis my shit. I heard that you were talking shit And you didn't think that I would hear it People hear you talking like that getting everybody fired up So I'm ready to attack gonna lead the pack Gonna get a touchdown gonna take you out That's right put your pom-poms down getting everybody fired up. Few times I've been around that track So it's not just gonna happen like that Cuz I ain't no hollaback girl I ain't no hollaback girl. Few times I've been around that track So it's not just gonna happen like that Cuz I ain't no hollaback girl I ain't no hollaback girl. This my shitthis my shit This my shitthis my shit This my shitthis my shit This my shitthis my shit. So that's right dude meet me at the bleachers No principals no student-teachers Both of us wanna be the winner but there can only be one So I'm gonna fight gonna give it my all Gonna make you fall gonna sock it to ya That's right I'm the last one standing and another one bites the dust. Few times I've been around that track So it's not just gonna happen like that Cuz I ain't no hollaback girl I ain't no hollaback girl. Few times I've been around that track So it's not just gonna happen like that Cuz I ain't no hollaback girl I ain't no hollaback girl This my shitthis my shit This my shitthis my shit This my shitthis my shit This my shitthis my shit. Let me hear you say this shit is bananas B-A-N-A-N-A-S! This shit is bananas B-A-N-A-N-A-S! Again this shit is bananas B-A-N-A-N-A-S! This shit is bananas B-A-N-A-N-A-S!. Few times I've been around that track So it's not just gonna happen like that Cuz I ain't no hollaback girl I ain't no hollaback girl. Few times I've been around that track So it's not just gonna happen like that Cuz I ain't no hollaback girl I ain't no hollaback girl. This my shitthis my shit This my shitthis my shit This my shitthis my shit This my shitthis my shit. 
2005,Mario,Let Me Love You,Mm Mm Yeah Mm Yeah yeah yeah Mm Yeah Mm Yeah yeah. Baby I just don't get it Do you enjoy being hurt? I know you smelled the perfume the make-up on his shirt You don't believe his stories You know that they're all lies Bad as you are you stick around and I just don't know why. If I was ya man (baby you) Never worry bout (what I do) I'd be coming home (back to you) Every night doin' you right You're the type of woman (deserves good things) Fist full of diamonds (hand full of rings) Baby you're a star (I just want to show youyou are). [Chorus] You should let me love you Let me be the one to give you everything you want and need Baby good love and protection Make me your selection I'll show you The way love's supposed to be Baby you should let me love you love you love you. Listen Your true beauty's description looks so good that it hurts You're a dime plus ninety-nine and it's a shame Don't even know what you're worth Everywhere you go they stop and stare Cause you're bad and it shows From your head to your toes Out of control baby you know. If I was ya man (baby you) Never worry bout (what I do) I'd be coming home (back to you) Every night doin' you right You're the type of woman (deserves good things) Fist full of diamonds (hand full of rings) Baby you're a star (I just want to show you you are). You should let me love you Let me be the one to give you everything you want and need Ooh Baby good love and protection Make me your selection Show you the way love's supposed to be Baby you should let me You deserve better girl (you know you deserve better) We should be together girl (baby) With me and you it's whatever girl hey! So can we make this thing ours?. You should let me love you Let me be the one to give you everything you want and need Baby good love and protection Make me your selection Show you the way love's supposed to be Baby you should let me love you love you love you. You should let me love you Let me be the one to give you everything you want and need Baby good love and protection Make me your selection Show you the way love's supposed to be Baby you should let me love you love you love you. You should let me love you Let me be the one to give you everything you want and need Baby good love and protection Make me your selection Show you the way love's supposed to be Baby you should let me love you love you love you. Let me love you that's all you need baby. 
2006,Daniel Powter,Bad Day,Where is the moment when needed the most? You kick up the leaves and the magic is lost They tell me your blue sky's faded to gray They tell me your passion's gone away And I don't need no carrying on Stand in the line just ahead of the law You're faking a smile with the coffee to go You tell me your life's been way off line You're falling to pieces every time And I don't need no carrying on. Cause you had a bad day You're taking one down You sing a sad song just to turn it around You say you don't know You tell me don't lie You work at a smile and you go for a ride You had a bad day The camera don't lie You're coming back down and you really don't mind You had a bad day You had a bad day. Well you need a blue sky holiday The point is they laugh at what you say And I don't need no carrying on. You had a bad day You're taking one down You sing a sad song just to turn it around You say you don't know You tell me don't lie You work at a smile and you go for a ride You had a bad day The camera don't lie You're coming back down and you really don't mind You had a bad day. Sometimes the system goes on the blink and the whole thing it turns out Wrong You might not make it back and you know that you could be well oh that Strong And I'm not wrong So where is the passion when you need it the most? Oh you and I You kick up the leaves and the magic is lost. Cause you had a bad day You're taking one down You sing a sad song just to turn it around You say you don't know You tell me don't lie You work at a smile and you go for a ride You had a bad day You see what you like And how does it feel one more time? You had a bad day You had a bad day. 
2006,Sean Paul,Temperature,The gal dem Schillaci Sean da Paul So me give it to so me give to so me give it to to all girls Five million and forty naughty shorty Baby girl baby girl Sean da Paul sey [Chorus] Well woman the way the time cold I wanna be keepin' you warm I got the right temperature to shelter you from the storm Oh lord gal I got the right tactics to turn you on and girl I Wanna be the Papa You can be the Mom oh oh!. Make I see the gal them bruk out pon the floor From you don't want no worthless performer From you don't want no man wey Can't turn you on gal make I see your hand them up on ya.. Can't tan pon it long naw eat no yam no steam fish nor no green banana But down in Jamaica we give it to you hot like a sauna. [Chorus]. b__per exposed and gal you got your chest out But you no wasters cause gal you impress out And if you des out a me you fi test out Cause I got the remedy to make you de-stress out Me haffi flaunt it because me God Bless out And girl if you want it you haffi confess out A no lie weh we need set speed a fi test the mattress out. [Chorus]. Gal don't say me crazy now this Strangelove it a no Bridgette and Flava show.. Time fi a make baby now so stop gwaan like you a act shady yo Woman don't play me know cause a no Fred Sanford nor Grady yo . My lovin' is the way to go my lovin' is the way to go [Chorus]. When you roll with a player like me With a bredda like me girl there is no other No need to talk it right here just park it right here keep it undercover From me love how you fit inna you blouse And you fat inna you jeans and mi waan discover Everything out you baby girl can you hear when me utter. 
2006,Nelly Furtado ft Timbaland,Promiscuous,How you doin' young lady That feelin' that you givin' really drives me crazy You don't haveta play about the joke I was at a loss of words first time that we spoke. Looking for a girl that'll treat you right You lookin' for her in the day time with the light You might be the type if I play my cards right I'll find out by the end of the night. [N:] You expect me to just let you hit it But will you still respect me if you get it. All I can do is try gimme one chance What's the problem I don't see no ring on your hand. I be the first to admit it I'm curious about you you seem so innocent. [N:] You wanna get in my world get lost in it Boy I'm tired of running lets walk for a minute. [Chorus] Promiscuous girl Wherever you are I'm all alone And it's you that I want. [N:] Promiscuous boy You already know That I'm all yours What you waiting for?. Promiscuous girl You're teasing me You know what I want And I got what you need. [N:] Promiscuous boy Let's get to the point Cause we're on a roll Are you ready?. [Verse] [N:] Roses are red Some diamonds are blue Chivalry is dead But you're still kinda cute. Hey! I can't keep my mind off you Where you at do you mind if I come through. [N:] I'm out of this world come with me to my planet Get you on my level do you think that you can handle it?. They call me Thomas last name Crown Recognize game I'm a lay mine's down. [N:] I'm a big girl I can handle myself But if I get lonely I'ma need your help Pay attention to me I don't talk for my health. I want you on my team [N:] So does everybody else.. Baby we can keep it on the low Let your guard down ain't nobody gotta know If you with it girl I know a place we can go. [N:] What kind of girl do you take me for?. [Chorus] Don't be mad don't get mean [N:] Don't get mad don't be mean. Hey! Don't be mad don't get mean [N:] Don't get mad don't be mean Wait! I don't mean no harm I can see you with my t-shirt on. I can see you with nothing on feeling on me before you bring that on. Bring that on [N:] You know what I mean. Girl I'm a freak you shouldn't say those things. I'm only trying to get inside your brain To see if you can work me the way you say. It's okay it's alright I got something that you gon' like. Hey is that the truth or are you talking trash Is your game M.V.P. like Steve Nash. [Chorus] Promiscuous Girl Wherever you are I'm all alone And its you that I want. [N:] Promiscuous Boy I'm calling your name But you're driving me crazy The way you're making me wait. Promiscuous Girl You're teasing me You know what I want And I got what you need. [N:] Promiscuous Boy We're one in the same So we don't gotta play games no more. 
